number,value,datetime_start,datetime_complete,duration,params_model__learning_rate,params_model__max_depth,params_model__max_features,params_model__min_samples_leaf,params_model__min_samples_split,params_model__n_estimators,params_model__subsample,state
0,0.783180222315276,2026-06-13 21:50:10.289446,2026-06-13 21:50:14.027502,0 days 00:00:03.738056,0.2536999076681772,3,log2,3,13,69,0.662397808134481,COMPLETE
1,0.7167905731416793,2026-06-13 21:50:14.027985,2026-06-13 21:50:17.054188,0 days 00:00:03.026203,0.11114989443094977,1,log2,13,20,80,0.6849356442713105,COMPLETE
2,0.7406028971746111,2026-06-13 21:50:17.054655,2026-06-13 21:50:20.266047,0 days 00:00:03.211392,0.05958389350068958,2,log2,10,7,65,0.6557975442608167,COMPLETE
3,0.7444164793741467,2026-06-13 21:50:20.266501,2026-06-13 21:50:24.020777,0 days 00:00:03.754276,0.14447746112718687,1,sqrt,9,11,73,0.6185801650879991,COMPLETE
4,0.7931580376487041,2026-06-13 21:50:24.021218,2026-06-13 21:50:29.058030,0 days 00:00:05.036812,0.2521267904777921,3,sqrt,5,17,53,0.6390688456025535,COMPLETE
5,0.6645164124578475,2026-06-13 21:50:29.058470,2026-06-13 21:50:31.854335,0 days 00:00:02.795865,0.05388108577817234,1,log2,4,19,56,0.8650089137415928,COMPLETE
6,0.7097973199844194,2026-06-13 21:50:31.854777,2026-06-13 21:50:36.026344,0 days 00:00:04.171567,0.01875220945578641,3,log2,15,16,77,0.9579309401710595,COMPLETE
7,0.6039734125158597,2026-06-13 21:50:36.026751,2026-06-13 21:50:39.382120,0 days 00:00:03.355369,0.01947558230629543,1,sqrt,6,8,54,0.7085396127095583,COMPLETE
8,0.702083744794465,2026-06-13 21:50:39.382499,2026-06-13 21:50:43.420586,0 days 00:00:04.038087,0.06333268775321842,1,sqrt,2,17,64,0.9947547746402069,COMPLETE
9,0.7937180166574785,2026-06-13 21:50:43.421033,2026-06-13 21:50:48.149394,0 days 00:00:04.728361,0.1601531217136121,3,sqrt,12,15,50,0.6296178606936361,COMPLETE
10,0.6680631890062392,2026-06-13 21:50:48.149778,2026-06-13 21:50:54.502268,0 days 00:00:06.352490,0.010206070557576998,2,sqrt,9,2,98,0.7813479247149042,COMPLETE
11,0.7940166481882155,2026-06-13 21:50:54.502673,2026-06-13 21:50:59.693721,0 days 00:00:05.191048,0.28176178568510296,3,sqrt,6,14,50,0.75128147522237,COMPLETE
12,0.7846938396522332,2026-06-13 21:50:59.694116,2026-06-13 21:51:04.882105,0 days 00:00:05.187989,0.14491980862121354,3,sqrt,12,13,50,0.7550376816255844,COMPLETE
13,0.7833348642135697,2026-06-13 21:51:04.882499,2026-06-13 21:51:09.843501,0 days 00:00:04.961002,0.2970187618675752,2,sqrt,7,14,59,0.8221501789532392,COMPLETE
14,0.7837488990126796,2026-06-13 21:51:09.843935,2026-06-13 21:51:15.500735,0 days 00:00:05.656800,0.09790167931296342,3,sqrt,1,10,59,0.7356056577882386,COMPLETE
15,0.7767607475015013,2026-06-13 21:51:15.501185,2026-06-13 21:51:20.090129,0 days 00:00:04.588944,0.16240290505406843,2,sqrt,15,15,50,0.8721390772632102,COMPLETE
16,0.7998881137236034,2026-06-13 21:51:20.090515,2026-06-13 21:51:26.896321,0 days 00:00:06.805806,0.1974242859272337,3,sqrt,12,11,93,0.6010280556565453,COMPLETE
17,0.8013301483503186,2026-06-13 21:51:26.896706,2026-06-13 21:51:33.515773,0 days 00:00:06.619067,0.22884186606102325,3,sqrt,7,4,89,0.6018960478612357,COMPLETE
18,0.7837659737474479,2026-06-13 21:51:33.516200,2026-06-13 21:51:38.859455,0 days 00:00:05.343255,0.08675288380799272,2,sqrt,8,2,92,0.6108876105564788,COMPLETE
19,0.7989385943416216,2026-06-13 21:51:38.859909,2026-06-13 21:51:45.430588,0 days 00:00:06.570679,0.19670263800314058,3,sqrt,11,5,86,0.6084172674584926,COMPLETE
20,0.7885122229413302,2026-06-13 21:51:45.430987,2026-06-13 21:51:51.477153,0 days 00:00:06.046166,0.2021849732464553,2,sqrt,13,5,100,0.6895998720718168,COMPLETE
21,0.7993821464026143,2026-06-13 21:51:51.477617,2026-06-13 21:51:57.868927,0 days 00:00:06.391310,0.20302352135113577,3,sqrt,11,5,86,0.602902492910886,COMPLETE
22,0.8029910108716385,2026-06-13 21:51:57.869312,2026-06-13 21:52:04.454733,0 days 00:00:06.585421,0.11790980801486892,3,sqrt,10,4,88,0.60824257346529,COMPLETE
23,0.7989263476755202,2026-06-13 21:52:04.455181,2026-06-13 21:52:11.628108,0 days 00:00:07.172927,0.11210581431925681,3,sqrt,8,7,93,0.6555079757722395,COMPLETE
24,0.7827403747492953,2026-06-13 21:52:11.628508,2026-06-13 21:52:18.063351,0 days 00:00:06.434843,0.039816506836572035,3,sqrt,10,4,86,0.6000964059067873,COMPLETE
25,0.7960978862987463,2026-06-13 21:52:18.063803,2026-06-13 21:52:25.200168,0 days 00:00:07.136365,0.12422845041043667,3,sqrt,14,9,92,0.6699604626771717,COMPLETE
26,0.7829611494088475,2026-06-13 21:52:25.200625,2026-06-13 21:52:29.091944,0 days 00:00:03.891319,0.08033911140452238,3,log2,8,3,82,0.7126212652973463,COMPLETE
27,0.8011651206763615,2026-06-13 21:52:29.092353,2026-06-13 21:52:36.180219,0 days 00:00:07.087866,0.192238939487444,3,sqrt,10,11,96,0.6308462011438296,COMPLETE
28,0.754392675320729,2026-06-13 21:52:36.180665,2026-06-13 21:52:41.545397,0 days 00:00:05.364732,0.04087971200804149,2,sqrt,7,6,89,0.6398099524327291,COMPLETE
29,0.804885916156783,2026-06-13 21:52:41.545847,2026-06-13 21:52:45.596073,0 days 00:00:04.050226,0.22822625069219526,3,log2,4,12,98,0.6589144875016182,COMPLETE
30,0.7965310876507392,2026-06-13 21:52:45.596520,2026-06-13 21:52:49.360915,0 days 00:00:03.764395,0.23695402281279102,3,log2,3,3,81,0.67770043191938,COMPLETE
31,0.8007812661360356,2026-06-13 21:52:49.361375,2026-06-13 21:52:53.361935,0 days 00:00:04.000560,0.17878091903400908,3,log2,5,12,97,0.6462522551002559,COMPLETE
32,0.7991736820894451,2026-06-13 21:52:53.362380,2026-06-13 21:52:57.318191,0 days 00:00:03.955811,0.13290414051461863,3,log2,3,9,89,0.7023238727404525,COMPLETE
33,0.7992451994651975,2026-06-13 21:52:57.318634,2026-06-13 21:53:01.337674,0 days 00:00:04.019040,0.2581341574004276,3,log2,10,7,96,0.6559761042887478,COMPLETE
34,0.7942570378073148,2026-06-13 21:53:01.338075,2026-06-13 21:53:05.466907,0 days 00:00:04.128832,0.10385022021475661,3,log2,9,12,100,0.6750592947215523,COMPLETE
35,0.7998295124396314,2026-06-13 21:53:05.467353,2026-06-13 21:53:09.406036,0 days 00:00:03.938683,0.23079135592662062,3,log2,5,9,95,0.6296516289437799,COMPLETE
36,0.7963403415841885,2026-06-13 21:53:09.406458,2026-06-13 21:53:13.234381,0 days 00:00:03.827923,0.13542014319843357,3,log2,7,19,89,0.6265572716807515,COMPLETE
37,0.7923493841384605,2026-06-13 21:53:13.234860,2026-06-13 21:53:19.421828,0 days 00:00:06.186968,0.17293922210197238,3,sqrt,10,11,76,0.6528307259658244,COMPLETE
38,0.776514696403435,2026-06-13 21:53:19.422511,2026-06-13 21:53:23.170629,0 days 00:00:03.748118,0.06869305217938614,3,log2,4,6,84,0.6264490756817885,COMPLETE
39,0.7961367967290872,2026-06-13 21:53:23.171103,2026-06-13 21:53:29.287446,0 days 00:00:06.116343,0.23307652835667647,2,sqrt,6,4,90,0.7210746182581375,COMPLETE
40,0.7885329483779929,2026-06-13 21:53:29.287904,2026-06-13 21:53:33.135856,0 days 00:00:03.847952,0.11483115948894607,3,log2,4,10,77,0.6901483583427259,COMPLETE
41,0.7988037051190863,2026-06-13 21:53:33.136312,2026-06-13 21:53:37.275390,0 days 00:00:04.139078,0.17007667926624398,3,log2,5,13,96,0.6460080023146649,COMPLETE
42,0.8097214622996862,2026-06-13 21:53:37.275869,2026-06-13 21:53:41.490693,0 days 00:00:04.214824,0.17842305976304482,3,log2,5,13,98,0.6649362361108251,COMPLETE
43,0.8008687452343024,2026-06-13 21:53:41.491165,2026-06-13 21:53:45.690003,0 days 00:00:04.198838,0.28999659316870235,3,log2,2,16,99,0.6672146448214035,COMPLETE
44,0.7993237188291715,2026-06-13 21:53:45.690467,2026-06-13 21:53:49.750207,0 days 00:00:04.059740,0.15068281941831707,3,log2,4,12,96,0.6227797784452098,COMPLETE
45,0.801574754640901,2026-06-13 21:53:49.750663,2026-06-13 21:53:53.892690,0 days 00:00:04.142027,0.22959723582024252,3,log2,9,14,94,0.6984273125408833,COMPLETE
46,0.8006616352529079,2026-06-13 21:53:53.893112,2026-06-13 21:53:58.000348,0 days 00:00:04.107236,0.22431005191896086,3,log2,9,19,94,0.699439227710993,COMPLETE
47,0.7978553752113148,2026-06-13 21:53:58.000763,2026-06-13 21:54:02.129895,0 days 00:00:04.129132,0.24771931564770522,3,log2,7,17,91,0.7324352344218183,COMPLETE
48,0.7914554314566535,2026-06-13 21:54:02.130297,2026-06-13 21:54:06.163497,0 days 00:00:04.033200,0.14149509613387462,3,log2,6,14,84,0.7722160776681334,COMPLETE
49,0.6968069949738684,2026-06-13 21:54:06.163898,2026-06-13 21:54:09.100808,0 days 00:00:02.936910,0.09000617861375676,1,log2,8,15,69,0.8902978046636372,COMPLETE
50,0.797171708072329,2026-06-13 21:54:09.101218,2026-06-13 21:54:13.482078,0 days 00:00:04.380860,0.27951644698444084,3,log2,11,13,98,0.8136452264371684,COMPLETE
51,0.8039582081049822,2026-06-13 21:54:13.482510,2026-06-13 21:54:20.534220,0 days 00:00:07.051710,0.1919172447989196,3,sqrt,9,16,95,0.6323683112501916,COMPLETE
52,0.8054164208463742,2026-06-13 21:54:20.534639,2026-06-13 21:54:27.451080,0 days 00:00:06.916441,0.20879065382314294,3,sqrt,9,16,87,0.6640590129494838,COMPLETE
53,0.7989089450492024,2026-06-13 21:54:27.451517,2026-06-13 21:54:34.451327,0 days 00:00:06.999810,0.15394506896150245,3,sqrt,9,18,87,0.6773703015753302,COMPLETE
54,0.8020387195313574,2026-06-13 21:54:34.451749,2026-06-13 21:54:41.674206,0 days 00:00:07.222457,0.12098214329385283,3,sqrt,2,16,94,0.6633796222497103,COMPLETE
55,0.8010599613017689,2026-06-13 21:54:41.674650,2026-06-13 21:54:49.055903,0 days 00:00:07.381253,0.12198639220464062,3,sqrt,1,16,98,0.662151231656694,COMPLETE
56,0.7943296273046127,2026-06-13 21:54:49.056319,2026-06-13 21:54:55.928457,0 days 00:00:06.872138,0.07948396275035291,3,sqrt,2,17,91,0.6375036162569506,COMPLETE
57,0.7106598788746801,2026-06-13 21:54:55.928900,2026-06-13 21:55:02.803783,0 days 00:00:06.874883,0.010363092807499568,3,sqrt,3,18,94,0.6158758430886703,COMPLETE
58,0.8031877565276698,2026-06-13 21:55:02.804238,2026-06-13 21:55:10.558569,0 days 00:00:07.754331,0.10062089101500488,3,sqrt,2,15,100,0.6838848111876006,COMPLETE
59,0.7891241111056778,2026-06-13 21:55:10.559012,2026-06-13 21:55:16.830405,0 days 00:00:06.271393,0.10213863158088356,2,sqrt,1,15,100,0.7258266334698111,COMPLETE
60,0.7894621803992783,2026-06-13 21:55:16.830875,2026-06-13 21:55:24.434085,0 days 00:00:07.603210,0.0586597017419543,3,sqrt,13,15,98,0.6866025944705786,COMPLETE
61,0.8007747637547178,2026-06-13 21:55:24.434501,2026-06-13 21:55:31.590109,0 days 00:00:07.155608,0.1274091919957485,3,sqrt,2,16,92,0.6671623652624924,COMPLETE
62,0.805267066877694,2026-06-13 21:55:31.590534,2026-06-13 21:55:38.967019,0 days 00:00:07.376485,0.18580627133940902,3,sqrt,1,20,87,0.7440031349850538,COMPLETE
63,0.7975967553632046,2026-06-13 21:55:38.967409,2026-06-13 21:55:46.179222,0 days 00:00:07.211813,0.17857056481152112,3,sqrt,3,18,84,0.7516783486696023,COMPLETE
64,0.8006005445000994,2026-06-13 21:55:46.179668,2026-06-13 21:55:53.308517,0 days 00:00:07.128849,0.2049872567796212,3,sqrt,1,20,79,0.7852036498905801,COMPLETE
65,0.8018989949085125,2026-06-13 21:55:53.308956,2026-06-13 21:56:00.501524,0 days 00:00:07.192568,0.1558030761449453,3,sqrt,11,13,88,0.7129609272126598,COMPLETE
66,0.8059852585470176,2026-06-13 21:56:00.501968,2026-06-13 21:56:08.854672,0 days 00:00:08.352704,0.1879387845579084,3,sqrt,12,19,82,0.9284368123430705,COMPLETE
67,0.8050600517328345,2026-06-13 21:56:08.855079,2026-06-13 21:56:17.111282,0 days 00:00:08.256203,0.2671728823059513,3,sqrt,14,20,79,0.9774411711261349,COMPLETE
68,0.811037179285153,2026-06-13 21:56:17.111724,2026-06-13 21:56:24.988537,0 days 00:00:07.876813,0.2091895181961779,3,sqrt,15,20,74,0.9781161013430069,COMPLETE
69,0.8028280823512794,2026-06-13 21:56:24.988984,2026-06-13 21:56:32.815673,0 days 00:00:07.826689,0.26259991226731355,3,sqrt,15,20,72,0.9860327517817824,COMPLETE
70,0.7643881299424227,2026-06-13 21:56:32.816070,2026-06-13 21:56:37.013316,0 days 00:00:04.197246,0.21268573029061774,1,sqrt,14,19,74,0.9284664368382068,COMPLETE
71,0.8088620092228718,2026-06-13 21:56:37.013724,2026-06-13 21:56:45.197102,0 days 00:00:08.183378,0.185675811432949,3,sqrt,14,20,79,0.96851855808464,COMPLETE
72,0.7991089119821803,2026-06-13 21:56:45.197547,2026-06-13 21:56:53.362654,0 days 00:00:08.165107,0.2637385360183325,3,sqrt,14,20,79,0.9628372406932342,COMPLETE
73,0.806184152166265,2026-06-13 21:56:53.363099,2026-06-13 21:57:01.649591,0 days 00:00:08.286492,0.18985676381687797,3,sqrt,14,19,82,0.9469557983087931,COMPLETE
74,0.8082156414334625,2026-06-13 21:57:01.650050,2026-06-13 21:57:09.738006,0 days 00:00:08.087956,0.19035924607281063,3,sqrt,14,19,81,0.9284632583982111,COMPLETE
75,0.8057897786051728,2026-06-13 21:57:09.738396,2026-06-13 21:57:17.858766,0 days 00:00:08.120370,0.1803488232482475,3,sqrt,15,19,82,0.9242977176049748,COMPLETE
76,0.8029951591072141,2026-06-13 21:57:17.859159,2026-06-13 21:57:26.125035,0 days 00:00:08.265876,0.1661885576234747,3,sqrt,15,19,83,0.9343739971433577,COMPLETE
77,0.8031340663256643,2026-06-13 21:57:26.125426,2026-06-13 21:57:34.297541,0 days 00:00:08.172115,0.20847948243557757,3,sqrt,13,18,81,0.9302543648074972,COMPLETE
78,0.7983629137313254,2026-06-13 21:57:34.298033,2026-06-13 21:57:42.091940,0 days 00:00:07.793907,0.1677119397515871,3,sqrt,14,18,77,0.9116572834255096,COMPLETE
79,0.8039719897204629,2026-06-13 21:57:42.092330,2026-06-13 21:57:49.894072,0 days 00:00:07.801742,0.1429280155701908,3,sqrt,12,19,75,0.9462922767110414,COMPLETE
80,0.8064240735687251,2026-06-13 21:57:49.894457,2026-06-13 21:57:57.164368,0 days 00:00:07.269911,0.18718675825810857,3,sqrt,15,19,71,0.9071035521347265,COMPLETE
81,0.8041079417367694,2026-06-13 21:57:57.164750,2026-06-13 21:58:04.719788,0 days 00:00:07.555038,0.1871927700343313,3,sqrt,15,19,72,0.9058063119138757,COMPLETE
82,0.806792456972056,2026-06-13 21:58:04.720285,2026-06-13 21:58:13.308045,0 days 00:00:08.587760,0.2168455970792431,3,sqrt,15,19,81,0.9618477451259234,COMPLETE
83,0.8004262801737554,2026-06-13 21:58:13.308507,2026-06-13 21:58:20.495330,0 days 00:00:07.186823,0.16204519078561772,3,sqrt,15,17,65,0.9616257164905408,COMPLETE
84,0.8002342733342426,2026-06-13 21:58:20.495719,2026-06-13 21:58:27.904960,0 days 00:00:07.409241,0.18400260271809107,3,sqrt,13,20,69,0.9460744919960354,COMPLETE
85,0.8068637461330688,2026-06-13 21:58:27.905427,2026-06-13 21:58:36.356401,0 days 00:00:08.450974,0.2208050275458217,3,sqrt,14,19,81,0.9775996235306577,COMPLETE
86,0.801019177376164,2026-06-13 21:58:36.356853,2026-06-13 21:58:43.987864,0 days 00:00:07.631011,0.24933987644175903,3,sqrt,14,17,69,0.9958325756395493,COMPLETE
87,0.8042490624627389,2026-06-13 21:58:43.988251,2026-06-13 21:58:51.377166,0 days 00:00:07.388915,0.21871238004157695,3,sqrt,13,18,67,0.9828130410600137,COMPLETE
88,0.8006544192684389,2026-06-13 21:58:51.377548,2026-06-13 21:58:59.685058,0 days 00:00:08.307510,0.15030311141514854,3,sqrt,14,19,80,0.9737269200416683,COMPLETE
89,0.8024073489281089,2026-06-13 21:58:59.685447,2026-06-13 21:59:07.222492,0 days 00:00:07.537045,0.23989184687098497,3,sqrt,13,20,78,0.8680584798701643,COMPLETE
90,0.8080718561207464,2026-06-13 21:59:07.222894,2026-06-13 21:59:14.869592,0 days 00:00:07.646698,0.2904962669257803,3,sqrt,15,18,73,0.9484210697775686,COMPLETE
91,0.8022183831526778,2026-06-13 21:59:14.869987,2026-06-13 21:59:22.586090,0 days 00:00:07.716103,0.2896712654878918,3,sqrt,15,19,74,0.9487388227606292,COMPLETE
92,0.8072099864575575,2026-06-13 21:59:22.586470,2026-06-13 21:59:30.584476,0 days 00:00:07.998006,0.21256581016396087,3,sqrt,14,18,76,0.9694898560759637,COMPLETE
93,0.8008191165060001,2026-06-13 21:59:30.584933,2026-06-13 21:59:38.125110,0 days 00:00:07.540177,0.22022948534128017,3,sqrt,14,18,71,0.9565112142996534,COMPLETE
94,0.8029070564531529,2026-06-13 21:59:38.125551,2026-06-13 21:59:46.109250,0 days 00:00:07.983699,0.19647611047785873,3,sqrt,15,17,76,0.9720125401297407,COMPLETE
95,0.8030459608622055,2026-06-13 21:59:46.109681,2026-06-13 21:59:53.866762,0 days 00:00:07.757081,0.24003504768646192,3,sqrt,14,20,71,0.9918164997896507,COMPLETE
96,0.792324936087461,2026-06-13 21:59:53.867159,2026-06-13 22:00:00.181092,0 days 00:00:06.313933,0.2993260219290615,3,sqrt,15,18,61,0.8494763771229499,COMPLETE
97,0.8098948464226481,2026-06-13 22:00:00.181483,2026-06-13 22:00:08.168008,0 days 00:00:07.986525,0.2005911228203214,3,sqrt,14,19,76,0.967117393708948,COMPLETE
98,0.8017586264542167,2026-06-13 22:00:08.168514,2026-06-13 22:00:16.063694,0 days 00:00:07.895180,0.2753022050938299,3,sqrt,13,17,74,0.9678864933231649,COMPLETE
99,0.8025313509928489,2026-06-13 22:00:16.064145,2026-06-13 22:00:23.729568,0 days 00:00:07.665423,0.13555697654686516,3,sqrt,15,20,76,0.9158384192245326,COMPLETE
